{"benchmark_id":"EZ-B003","challenge_ids":["neutron-N20","neutron-N28","neutron-N50","neutron-N82","neutron-N126","proton-Z20","proton-Z28","proton-Z50","proton-Z82"],"challenge_manifest_hash":"0a3009ed865d512992ae15a806913f6f602466b659f1090f6d845e65b167c7f9","challenge_manifest_hash_rule":"ez-b003-challenge-manifest-hash-v1: sha256 of canonical JSON of {\"hash_rule\", \"challenge_policy_id\", \"mask_policy_id\", \"support_policy_id\", \"support_settings\", \"challenges\": [{axis, closure, status, mask} sorted by (axis, closure)]}. Challenge order in the file and any generator metadata cannot change the digest; a mask bound, a closure, or an evaluability verdict always does.","challenge_policy_id":"ez-b003-shell-challenge-v1","challenges":[{"axis":"neutron","chain_support":[{"chain":24,"closure_computable":false,"lower_support":false,"n_masked_targets":0,"n_peak_candidates":0,"n_window_training":0,"reasons":["chain holds no eligible masked target","the indicator at the closure is not computable; missing eligible inputs [(24, 18), (24, 20), (24, 22)]","two-step lower neighbor 18 is not available outside the mask","two-step upper neighbor 22 is not available outside the mask","chain has 0 eligible nuclei outside the mask in the search window; MIN_CHAIN_LENGTH is 5","chain has 0 computable indicator positions; MIN_PEAK_CANDIDATES is 3"],"supported":false,"upper_support":false},{"chain":25,"closure_computable":false,"lower_support":false,"n_masked_targets":0,"n_peak_candidates":0,"n_window_training":0,"reasons":["chain holds no eligible masked target","the indicator at the closure is not computable; missing eligible inputs [(25, 18), (25, 20), (25, 22)]","two-step lower neighbor 18 is not available outside the mask","two-step upper neighbor 22 is not available outside the mask","chain has 0 eligible nuclei outside the mask in the search window; MIN_CHAIN_LENGTH is 5","chain has 0 computable indicator positions; MIN_PEAK_CANDIDATES is 3"],"supported":false,"upper_support":false},{"chain":26,"closure_computable":false,"lower_support":false,"n_masked_targets":0,"n_peak_candidates":0,"n_window_training":0,"reasons":["chain holds no eligible masked target","the indicator at the closure is not computable; missing eligible inputs [(26, 18), (26, 20), (26, 22)]","two-step lower neighbor 18 is not available outside the mask","two-step upper neighbor 22 is not available outside the mask","chain has 0 eligible nuclei outside the mask in the search window; MIN_CHAIN_LENGTH is 5","chain has 0 computable indicator positions; MIN_PEAK_CANDIDATES is 3"],"supported":false,"upper_support":false},{"chain":27,"closure_computable":false,"lower_support":false,"n_masked_targets":0,"n_peak_candidates":0,"n_window_training":0,"reasons":["chain holds no eligible masked target","the indicator at the closure is not computable; missing eligible inputs [(27, 18), (27, 20), (27, 22)]","two-step lower neighbor 18 is not available outside the mask","two-step upper neighbor 22 is not available outside the mask","chain has 0 eligible nuclei outside the mask in the search window; MIN_CHAIN_LENGTH is 5","chain has 0 computable indicator positions; MIN_PEAK_CANDIDATES is 3"],"supported":false,"upper_support":false},{"chain":28,"closure_computable":false,"lower_support":false,"n_masked_targets":0,"n_peak_candidates":0,"n_window_training":0,"reasons":["chain holds no eligible masked target","the indicator at the closure is not computable; missing eligible inputs [(28, 18), (28, 20), (28, 22)]","two-step lower neighbor 18 is not available outside the mask","two-step upper neighbor 22 is not available outside the mask","chain has 0 eligible nuclei outside the mask in the search window; MIN_CHAIN_LENGTH is 5","chain has 0 computable indicator positions; MIN_PEAK_CANDIDATES is 3"],"supported":false,"upper_support":false},{"chain":29,"closure_computable":false,"lower_support":false,"n_masked_targets":0,"n_peak_candidates":0,"n_window_training":0,"reasons":["chain holds no eligible masked target","the indicator at the closure is not computable; missing eligible inputs [(29, 18), (29, 20), (29, 22)]","two-step lower neighbor 18 is not available outside the mask","two-step upper neighbor 22 is not available outside the mask","chain has 0 eligible nuclei outside the mask in the search window; MIN_CHAIN_LENGTH is 5","chain has 0 computable indicator positions; MIN_PEAK_CANDIDATES is 3"],"supported":false,"upper_support":false},{"chain":30,"closure_computable":false,"lower_support":false,"n_masked_targets":0,"n_peak_candidates":0,"n_window_training":0,"reasons":["chain holds no eligible masked target","the indicator at the closure is not computable; missing eligible inputs [(30, 18), (30, 20), (30, 22)]","two-step lower neighbor 18 is not available outside the mask","two-step upper neighbor 22 is not available outside the mask","chain has 0 eligible nuclei outside the mask in the search window; MIN_CHAIN_LENGTH is 5","chain has 0 computable indicator positions; MIN_PEAK_CANDIDATES is 3"],"supported":false,"upper_support":false},{"chain":31,"closure_computable":false,"lower_support":false,"n_masked_targets":0,"n_peak_candidates":0,"n_window_training":0,"reasons":["chain holds no eligible masked target","the indicator at the closure is not computable; missing eligible inputs [(31, 18), (31, 20), (31, 22)]","two-step lower neighbor 18 is not available outside the mask","two-step upper neighbor 22 is not available outside the mask","chain has 0 eligible nuclei outside the mask in the search window; MIN_CHAIN_LENGTH is 5","chain has 0 computable indicator positions; MIN_PEAK_CANDIDATES is 3"],"supported":false,"upper_support":false},{"chain":32,"closure_computable":false,"lower_support":false,"n_masked_targets":0,"n_peak_candidates":0,"n_window_training":0,"reasons":["chain holds no eligible masked target","the indicator at the closure is not computable; missing eligible inputs [(32, 18), (32, 20), (32, 22)]","two-step lower neighbor 18 is not available outside the mask","two-step upper neighbor 22 is not available outside the mask","chain has 0 eligible nuclei outside the mask in the search window; MIN_CHAIN_LENGTH is 5","chain has 0 computable indicator positions; MIN_PEAK_CANDIDATES is 3"],"supported":false,"upper_support":false},{"chain":33,"closure_computable":false,"lower_support":false,"n_masked_targets":0,"n_peak_candidates":0,"n_window_training":0,"reasons":["chain holds no eligible masked target","the indicator at the closure is not computable; missing eligible inputs [(33, 18), (33, 20), (33, 22)]","two-step lower neighbor 18 is not available outside the mask","two-step upper neighbor 22 is not available outside the mask","chain has 0 eligible nuclei outside the mask in the search window; MIN_CHAIN_LENGTH is 5","chain has 0 computable indicator positions; MIN_PEAK_CANDIDATES is 3"],"supported":false,"upper_support":false},{"chain":34,"closure_computable":false,"lower_support":false,"n_masked_targets":0,"n_peak_candidates":0,"n_window_training":0,"reasons":["chain holds no eligible masked target","the indicator at the closure is not computable; missing eligible inputs [(34, 18), (34, 20), (34, 22)]","two-step lower neighbor 18 is not available outside the mask","two-step upper neighbor 22 is not available outside the mask","chain has 0 eligible nuclei outside the mask in the search window; MIN_CHAIN_LENGTH is 5","chain has 0 computable indicator positions; MIN_PEAK_CANDIDATES is 3"],"supported":false,"upper_support":false},{"chain":35,"closure_computable":false,"lower_support":false,"n_masked_targets":0,"n_peak_candidates":0,"n_window_training":0,"reasons":["chain holds no eligible masked target","the indicator at the closure is not computable; missing eligible inputs [(35, 18), (35, 20), (35, 22)]","two-step lower neighbor 18 is not available outside the mask","two-step upper neighbor 22 is not available outside the mask","chain has 0 eligible nuclei outside the mask in the search window; MIN_CHAIN_LENGTH is 5","chain has 0 computable indicator positions; MIN_PEAK_CANDIDATES is 3"],"supported":false,"upper_support":false},{"chain":36,"closure_computable":false,"lower_support":false,"n_masked_targets":0,"n_peak_candidates":0,"n_window_training":0,"reasons":["chain holds no eligible masked target","the indicator at the closure is not computable; missing eligible inputs [(36, 18), (36, 20), (36, 22)]","two-step lower neighbor 18 is not available outside the mask","two-step upper neighbor 22 is not available outside the mask","chain has 0 eligible nuclei outside the mask in the search window; MIN_CHAIN_LENGTH is 5","chain has 0 computable indicator positions; MIN_PEAK_CANDIDATES is 3"],"supported":false,"upper_support":false},{"chain":37,"closure_computable":false,"lower_support":false,"n_masked_targets":0,"n_peak_candidates":0,"n_window_training":0,"reasons":["chain holds no eligible masked target","the indicator at the closure is not computable; missing eligible inputs [(37, 18), (37, 20), (37, 22)]","two-step lower neighbor 18 is not available outside the mask","two-step upper neighbor 22 is not available outside the mask","chain has 0 eligible nuclei outside the mask in the search window; MIN_CHAIN_LENGTH is 5","chain has 0 computable indicator positions; MIN_PEAK_CANDIDATES is 3"],"supported":false,"upper_support":false},{"chain":38,"closure_computable":false,"lower_support":false,"n_masked_targets":0,"n_peak_candidates":0,"n_window_training":0,"reasons":["chain holds no eligible masked target","the indicator at the closure is not computable; missing eligible inputs [(38, 18), (38, 20), (38, 22)]","two-step lower neighbor 18 is not available outside the mask","two-step upper neighbor 22 is not available outside the mask","chain has 0 eligible nuclei outside the mask in the search window; MIN_CHAIN_LENGTH is 5","chain has 0 computable indicator positions; MIN_PEAK_CANDIDATES is 3"],"supported":false,"upper_support":false},{"chain":39,"closure_computable":fa